{
  "schemaVersion": 1,
  "menuId": "3f2b8c1e-6d4a-4e2b-9a71-0c5d2e8f1a44",
  "menuRevision": 1,
  "parentItemId": "a1b2c3d4e5f60718293a4b5c6d7e8f90",
  "resolvedAt": "2026-09-30T19:05:00Z",
  "bindings": {
    "making-of": { "status": "matched", "itemId": "0f1e2d3c4b5a69788796a5b4c3d2e1f0", "method": "duration", "confidence": 0.98, "observedDurationSec": 1844.2 },
    "del-rooftop": { "status": "matched", "itemId": "11112222333344445555666677778888", "method": "duration+ordinal", "confidence": 0.85, "observedDurationSec": 141.6 },
    "del-lobby": { "status": "matched", "itemId": "9999aaaabbbbccccddddeeeeffff0000", "method": "manual", "confidence": 1 },
    "trailer": { "status": "unmatched" }
  }
}
